{
  "analysis": {
    "averaging": "exponential",
    "db_reference": "dbfs_sine",
    "dc_blocker_hz": 20,
    "decimations": 0,
    "fft_size": 8192,
    "hold": "none",
    "interval_ms": 40,
    "resolution": {
      "bin_width_hz": 3.90625,
      "enbw_hz": 7.829504,
      "hop_samples": 1280,
      "window_duration_ms": 256.0
    },
    "sample_rate_hz": 32000,
    "smoothing": 0.15,
    "spectrum_type": "power_spectrum",
    "weighting": "Z",
    "window": {
      "coefficients": [
        0.35875,
        0.48829,
        0.14128,
        0.01168
      ],
      "coherent_gain": 0.35875,
      "coherent_gain_db": -8.904162,
      "enbw_bins": 2.004353,
      "form": "periodic",
      "name": "blackman_harris"
    }
  },
  "description": "Long Blackman-Harris window for steadiness work: vibrato rate and extent on a held note, where sidelobe suppression matters more than time resolution.",
  "display": {
    "db_ceiling_dbfs": 0,
    "db_floor_dbfs": -90,
    "freq_max_hz": 8000,
    "freq_min_hz": 60,
    "freq_scale": "log",
    "overlays": [
      "f0",
      "vibrato_rate",
      "peak_markers"
    ],
    "refresh_hz_target": 25
  },
  "guidance": "Held note, one breath per trial. The 25 Hz frame rate samples a 5-7 Hz vibrato about four times per cycle; faster modulation is not resolved by this preset.",
  "id": "sustained_pitch_lab",
  "mic_eq": {
    "mode": "none"
  },
  "name": "Sustained pitch lab",
  "provisional": [
    "/analysis/dc_blocker_hz",
    "/display/db_floor_dbfs"
  ],
  "schema_version": "1.0.0",
  "targets": [
    "watch",
    "host"
  ]
}
